Ligand_WB,Receptor_WB,Ligand_symbol,Receptor_symbol,score,index,LR Function,L Function,R Function,Ligand_desc,Receptor_desc
WBGene00000903,WBGene00004860,daf-7,sma-6,1.0,1,TGF-B signaling,GDF11,BMPRIB,"Is an ortholog of human GDF11 (growth differentiation factor 11) and MSTN (myostatin). Is predicted to have cytokine activity and transforming growth factor beta receptor binding activity. Is involved in several processes, including cellular response to cGMP; regulation of gene expression; and response to bacterium. Localizes to extracellular space. Is expressed in coelomocyte; head neurons; pharynx; and in male. Human ortholog(s) of this gene are implicated in several diseases, including Klippel-Feil syndrome (multiple); Loeys-Dietz syndrome (multiple); and bone disease (multiple).","Is an ortholog of human BMPR1A (bone morphogenetic protein receptor type 1A) and BMPR1B (bone morphogenetic protein receptor type 1B). Exhibits BMP binding activity. Is involved in several processes, including defense response to other organism; nematode male tail tip morphogenesis; and positive regulation of macromolecule metabolic process. Is expressed in ASI; hypodermis; intestinal cell; pharynx; and tail. Human ortholog(s) of this gene are implicated in several diseases, including Loeys-Dietz syndrome (multiple); fibrodysplasia ossificans progressiva; and hereditary hemorrhagic telangiectasia."
WBGene00002881,WBGene00006894,let-756,ver-1,1.0,7,Canonical RTK-Ras-ERK signaling,FGF,fms-related tyrosine kinase 1,"Is an ortholog of human FGF16 (fibroblast growth factor 16) and FGF20 (fibroblast growth factor 20). Exhibits growth factor activity; protein kinase binding activity; and transcription factor binding activity. Is involved in fibroblast growth factor receptor signaling pathway; nematode larval development; and regulation of cell projection organization. Localizes to cytoplasm; extracellular space; and nucleus. Is expressed in several structures, including CAN; OLL; cephalic sensillum; muscle cell; and pharyngeal cell. Human ortholog(s) of this gene are implicated in several diseases, including LADD syndrome; bone disease (multiple); and hypogonadotropic hypogonadism (multiple).","Is an ortholog of human FLT1 (fms related receptor tyrosine kinase 1). Is predicted to have transmembrane receptor protein tyrosine kinase activity. Is involved in nematode male tail tip morphogenesis. Is expressed in intestinal muscle; intestine; and neuronal sheath cell. Human ortholog(s) of this gene are implicated in several diseases, including bone development disease (multiple); gastrointestinal system cancer (multiple); and hematologic cancer (multiple)."
WBGene00000527,WBGene00001687,cle-1,gpn-1,1.0,13,Cell adhesion,Collagen,Glypican (co-receptor) Frizzled homolog,"Is an ortholog of human COL15A1 (collagen type XV alpha 1 chain) and COL18A1 (collagen type XVIII alpha 1 chain). Is involved in several processes, including cholinergic synaptic transmission; generation of neurons; and inductive cell migration. Localizes to basement membrane and cell junction. Is expressed in several structures, including basal lamina; head mesodermal cell; neurons; smooth muscle; and somatic nervous system.","Is an ortholog of human GPC1 (glypican 1) and GPC6 (glypican 6). Is involved in several processes, including epidermis morphogenesis; nematode larval development; and neuron migration. Is expressed in neuroblasts and ventral cord neurons. Human ortholog(s) of this gene are implicated in Simpson-Golabi-Behmel syndrome type 1; nephroblastoma; and omodysplasia."
WBGene00002280,WBGene00003930,let-2,pat-3,1.0,26,Cell adhesion,Collagen,Integrin,"Is an ortholog of human COL4A5 (collagen type IV alpha 5 chain) and COL4A6 (collagen type IV alpha 6 chain). Exhibits extracellular matrix structural constituent conferring tensile strength. Is involved in several processes, including embryo development; gonad morphogenesis; and regulation of distal tip cell migration. Localizes to collagen type IV trimer. Is expressed in several structures, including coelomocyte; egg-laying apparatus; rectal muscle; spermatheca; and tail.","Is an ortholog of human ITGB1 (integrin subunit beta 1). Is predicted to have integrin binding activity. Is involved in several processes, including mitochondrion organization; muscle cell cellular homeostasis; and positive regulation of cellular component organization. Localizes to several cellular components, including contractile fiber; focal adhesion; and lateral plasma membrane. Is expressed in egg-laying apparatus; enteric muscle; gonad; uterine epithelial cell; and vulval precursor cell. Human ortholog(s) of this gene are implicated in leukocyte adhesion deficiency 1."
WBGene00005648,WBGene00008779,srp-7,F14B4.1,1.0,28,Wnt signaling,Serpin family (Blocks wnt signaling),Wnt-Receptor,"Is an ortholog of human SERPINB11 (serpin family B member 11 (gene/pseudogene)). Is predicted to have serine-type endopeptidase inhibitor activity. Is involved in IRE1-mediated unfolded protein response. Human ortholog(s) of this gene are implicated in several diseases, including alpha 1-antitrypsin deficiency; alpha-2-plasmin inhibitor deficiency; and osteogenesis imperfecta (multiple).",Is predicted to have Wnt-activated receptor activity and Wnt-protein binding activity. Human ortholog(s) of this gene are implicated in familial hypercholesterolemia.
WBGene00002005,WBGene00008779,hsp-1,F14B4.1,1.0,34,Stress response,Heat shock Protein,Wnt-Receptor,"Is an ortholog of human HSPA1B (heat shock protein family A (Hsp70) member 1B) and HSPA8 (heat shock protein family A (Hsp70) member 8). Exhibits ATPase activity. Is involved in determination of adult lifespan; response to heat; and retrograde transport, endosome to Golgi. Localizes to cytosol and nucleus. Is expressed in germ line and intestine.",Is predicted to have Wnt-activated receptor activity and Wnt-protein binding activity. Human ortholog(s) of this gene are implicated in familial hypercholesterolemia.
WBGene00000674,WBGene00016104,col-99,ddr-1,1.0,35,Cell adhesion,Collagen,Discoidin domain receptor,"Is an ortholog of human COL13A1 (collagen type XIII alpha 1 chain). Is predicted to have extracellular matrix structural constituent. Is involved in axon guidance. Localizes to several cellular components, including extracellular space; neuromuscular junction; and spanning component of plasma membrane. Is expressed in anal depressor muscle; body wall musculature; hypodermis; neurons; and retrovesicular ganglion. Human ortholog(s) of this gene are implicated in congenital myasthenic syndrome 19.",Is an ortholog of human DDR1 (discoidin domain receptor tyrosine kinase 1) and DDR2 (discoidin domain receptor tyrosine kinase 2). Is predicted to have collagen binding activity and protein tyrosine kinase collagen receptor activity. Is involved in motor neuron axon guidance and positive regulation of axon regeneration. Is expressed in hypodermis; intestinal muscle; nervous system; and pharynx.
WBGene00006746,WBGene00007764,unc-6,C27B7.7,1.0,44,Cell migration,Netrin (dorsal-ventral),Ig domain - Receptor,"Is an ortholog of human NTN1 (netrin 1). Is predicted to have signaling receptor binding activity. Is involved in several processes, including establishment or maintenance of actin cytoskeleton polarity; generation of neurons; and nematode male tail tip morphogenesis. Localizes to axon; basement membrane; and cytoplasm. Is expressed in several structures, including P1; VA12; accessory cell; interneuron; and somatic neurons.","Is an ortholog of human DSCAM (DS cell adhesion molecule) and DSCAML1 (DS cell adhesion molecule like 1). Human ortholog(s) of this gene are implicated in several diseases, including Compton-North congenital myopathy; MASA syndrome; and holoprosencephaly 11. Is predicted to encode a protein with the following domains: Fibronectin type III domain; Fibronectin type III; Immunoglobulin-like fold; Fibronectin type III superfamily; and Immunoglobulin-like domain superfamily."
WBGene00003738,WBGene00004215,nid-1,ptp-3,1.0,46,Cell adhesion,Nidogen,LAR-RPTP,"Is an ortholog of human NID1 (nidogen 1) and NID2 (nidogen 2). Exhibits extracellular matrix structural constituent. Is involved in several processes, including cholinergic synaptic transmission; nervous system development; and protein localization to synapse. Localizes to basal part of cell and basement membrane. Is expressed in several structures, including enteric muscle; gonad; labial sensillum; neurons; and vulval cell. Human ortholog(s) of this gene are implicated in Donnai-Barrow syndrome and familial hypercholesterolemia.","Is an ortholog of human PTPRD (protein tyrosine phosphatase receptor type D) and PTPRF (protein tyrosine phosphatase receptor type F). Is predicted to have transmembrane receptor protein tyrosine phosphatase activity. Is involved in several processes, including embryonic morphogenesis; nervous system development; and neuroblast migration. Localizes to adherens junction and synapse. Is expressed in embryonic cell; hypodermis; and nervous system."
WBGene00001700,WBGene00004208,grd-11,ptc-1,1.0,50,Hedgehog signaling,DHH,PTCH1,"Is an ortholog of human DHH (desert hedgehog signaling molecule); IHH (Indian hedgehog signaling molecule); and SHH (sonic hedgehog signaling molecule). Human ortholog(s) of this gene are implicated in several diseases, including 46 XY gonadal dysgenesis; bone development disease (multiple); and holoprosencephaly 3. Is predicted to encode a protein with the following domains: Hint module; Ground-like domain; Hedgehog protein, Hint domain; Hint domain C-terminal; Hint domain N-terminal; Ground-like domain; and Hint domain superfamily.",Is an ortholog of human PTCH1 (patched 1) and PTCH2 (patched 2). Is predicted to have hedgehog family protein binding activity; hedgehog receptor activity; and smoothened binding activity. Is involved in molting cycle. Localizes to integral component of plasma membrane. Is used to study Parkinson's disease.
WBGene00001328,WBGene00003930,epi-1,pat-3,1.0,54,Cell adhesion,Laminin,Integrin,"Is an ortholog of human LAMA5 (laminin subunit alpha 5). Is predicted to have extracellular matrix structural constituent. Is involved in several processes, including basement membrane organization; generation of neurons; and positive regulation of endopeptidase activity. Localizes to basement membrane. Is expressed in several structures, including anal depressor muscle; basal lamina; body wall musculature; egg-laying apparatus; and intestine. Human ortholog(s) of this gene are implicated in several diseases, including Pierson syndrome; amelogenesis imperfecta type 1A; and junctional epidermolysis bullosa (multiple).","Is an ortholog of human ITGB1 (integrin subunit beta 1). Is predicted to have integrin binding activity. Is involved in several processes, including mitochondrion organization; muscle cell cellular homeostasis; and positive regulation of cellular component organization. Localizes to several cellular components, including contractile fiber; focal adhesion; and lateral plasma membrane. Is expressed in egg-laying apparatus; enteric muscle; gonad; uterine epithelial cell; and vulval precursor cell. Human ortholog(s) of this gene are implicated in leukocyte adhesion deficiency 1."
WBGene00000857,WBGene00003006,cwn-1,lin-17,1.0,57,Wnt signaling,Wnt,Frizzled,"Is an ortholog of human WNT4 (Wnt family member 4). Exhibits receptor tyrosine kinase binding activity. Is involved in several processes, including generation of neurons; neuroblast migration; and regulation of vulval development. Is expressed in several structures, including CAN; hypodermal cell; intestine; muscle cell; and somatic nervous system. Human ortholog(s) of this gene are implicated in several diseases, including Mullerian aplasia and hyperandrogenism; autosomal dominant Robinow syndrome 1; and bone development disease (multiple).","Is an ortholog of human FZD4 (frizzled class receptor 4). Exhibits receptor tyrosine kinase binding activity. Is involved in several processes, including asymmetric protein localization involved in cell fate determination; axis specification; and generation of neurons. Localizes to neuron projection membrane. Is expressed in several structures, including P3.p male; P4.p male; PQR; epithelial cell; and male-specific anatomical entity. Human ortholog(s) of this gene are implicated in exudative vitreoretinopathy 1."
WBGene00000857,WBGene00003238,cwn-1,mig-1,1.0,60,Wnt signaling,Wnt,Frizzled,"Is an ortholog of human WNT4 (Wnt family member 4). Exhibits receptor tyrosine kinase binding activity. Is involved in several processes, including generation of neurons; neuroblast migration; and regulation of vulval development. Is expressed in several structures, including CAN; hypodermal cell; intestine; muscle cell; and somatic nervous system. Human ortholog(s) of this gene are implicated in several diseases, including Mullerian aplasia and hyperandrogenism; autosomal dominant Robinow syndrome 1; and bone development disease (multiple).",Is predicted to have Wnt-activated receptor activity and Wnt-protein binding activity. Is involved in generation of neurons; mitochondrial unfolded protein response; and neuroblast migration. Is expressed in anal depressor muscle; head muscle; and neurons. Human ortholog(s) of this gene are implicated in nonsyndromic congenital nail disorder 10 and omodysplasia.
WBGene00006750,WBGene00006765,unc-10,unc-29,1.0,62,Neuronal communication,Organization of presynaptic sites,Cholinergic Receptor,"Is an ortholog of human RIMS1 (regulating synaptic membrane exocytosis 1). Exhibits Rab GTPase binding activity and protein C-terminus binding activity. Is involved in several processes, including chemical synaptic transmission; defecation; and positive regulation of cholinergic synaptic transmission. Localizes to axon and presynaptic active zone. Is expressed in dorsal nerve cord; nerve ring; and ventral nerve cord. Human ortholog(s) of this gene are implicated in cone-rod dystrophy 7.","Is an ortholog of several human genes including CHRNB2 (cholinergic receptor nicotinic beta 2 subunit); CHRNB3 (cholinergic receptor nicotinic beta 3 subunit); and CHRNB4 (cholinergic receptor nicotinic beta 4 subunit). Exhibits acetylcholine-gated cation-selective channel activity. Is involved in several processes, including neuromuscular synaptic transmission; positive regulation of acetylcholine secretion, neurotransmission; and positive regulation of locomotion involved in locomotory behavior. Localizes to neuron projection; neuronal cell body; and postsynaptic membrane. Is expressed in body wall musculature; head neurons; non-striated muscle; and somatic nervous system."
WBGene00003111,WBGene00004048,mab-20,plx-2,1.0,86,Cell migration,Semaphorin (axon guidance),Plexin (semaphorin receptor),"Is an ortholog of human SEMA4D (semaphorin 4D). Exhibits semaphorin receptor binding activity. Is involved in several processes, including embryonic morphogenesis; generation of neurons; and male anatomical structure morphogenesis. Localizes to cell surface. Is expressed in several structures, including linker cell; ray neurons; ray precursor cell; somatic nervous system; and vulval cell. Human ortholog(s) of this gene are implicated in CHARGE syndrome; hypogonadotropic hypogonadism (multiple); and retinal degeneration (multiple).","Is an ortholog of human PLXNC1 (plexin C1) and PLXND1 (plexin D1). Exhibits semaphorin receptor activity. Is involved in several processes, including generation of neurons; nematode larval development; and nematode male tail tip morphogenesis. Localizes to cell leading edge and cell surface. Is expressed in several structures, including P3/4L; P9/10L; P9/10R; neuroblasts; and ray structural cell."
WBGene00003029,WBGene00000289,lin-44,cam-1,1.0,95,Wnt signaling,Wnt,Wnt-Receptor (Antagonistic activity),"Is an ortholog of human WNT10A (Wnt family member 10A) and WNT10B (Wnt family member 10B). Is predicted to have frizzled binding activity and receptor ligand activity. Is involved in several processes, including generation of neurons; nematode male tail tip morphogenesis; and neuroblast migration. Is expressed in several structures, including P6.pa; P6.pp; anchor cell; rectal epithelial cell; and tail. Human ortholog(s) of this gene are implicated in several diseases, including Mullerian aplasia and hyperandrogenism; autosomal dominant Robinow syndrome 1; and bone development disease (multiple).","Is an ortholog of human ROR1 (receptor tyrosine kinase like orphan receptor 1) and ROR2 (receptor tyrosine kinase like orphan receptor 2). Exhibits Wnt-protein binding activity; frizzled binding activity; and transmembrane receptor protein tyrosine kinase activity. Is involved in generation of neurons; neuroblast migration; and peptidyl-tyrosine phosphorylation. Localizes to several cellular components, including dendrite; neuromuscular junction; and neuronal cell body membrane. Is expressed in several structures, including QL.aa; body wall musculature; nervous system; pharynx; and seam cell. Human ortholog(s) of this gene are implicated in several diseases, including autosomal recessive nonsyndromic deafness (multiple); gastrointestinal system cancer (multiple); and hematologic cancer (multiple)."
WBGene00003395,WBGene00003007,mom-2,lin-18,1.0,101,Wnt signaling,Wnt,Ryk/Derailed,"Exhibits receptor tyrosine kinase binding activity. Is involved in several processes, including asymmetric protein localization involved in cell fate determination; embryonic morphogenesis; and generation of neurons. Is expressed in several structures, including HSN; Z2; Z3; anchor cell; and epithelial cell. Human ortholog(s) of this gene are implicated in several diseases, including Mullerian aplasia and hyperandrogenism; autosomal dominant Robinow syndrome 1; and bone development disease (multiple).","Is an ortholog of human RYK (receptor like tyrosine kinase). Is predicted to have ATP binding activity and protein kinase activity. Is involved in several processes, including asymmetric protein localization involved in cell fate determination; axis specification; and positive regulation of neurogenesis. Localizes to cytoplasm; nucleus; and plasma membrane. Is expressed in body wall musculature; neurons; and vulva."
WBGene00006324,WBGene00001609,sup-17,glp-1,1.0,106,Notch signaling,ADAM (facilitates lin-12 signaling),Notch,"Is an ortholog of human ADAM10 (ADAM metallopeptidase domain 10). Is predicted to have metalloendopeptidase activity. Is involved in several processes, including nematode male tail tip morphogenesis; positive regulation of transforming growth factor beta receptor signaling pathway; and vulval development. Localizes to cytoplasmic vesicle membrane and plasma membrane. Is expressed in M lineage cell; hypodermis; intestinal cell; spermatheca; and vulva. Human ortholog(s) of this gene are implicated in several diseases, including Alzheimer's disease 18; cone-rod dystrophy 9; and early infantile epileptic encephalopathy 61.","Is an ortholog of human NOTCH1 (notch receptor 1); NOTCH2 (notch receptor 2); and NOTCH3 (notch receptor 3). Exhibits RNA polymerase II transcription factor binding activity and transcription coactivator activity. Is involved in several processes, including maintenance of dauer; pharyngeal muscle development; and positive regulation of cell population proliferation. Localizes to several cellular components, including RNA polymerase II transcription factor complex; lateral plasma membrane; and spanning component of plasma membrane. Is expressed in several structures, including anus; germ line; neurons; somatic nervous system; and vulval precursor cell. Is used to study cancer. Human ortholog(s) of this gene are implicated in several diseases, including Adams-Oliver syndrome; Alagille syndrome; and CADASIL 1."
WBGene00003029,WBGene00000478,lin-44,cfz-2,1.0,112,Wnt signaling,Wnt,Frizzled,"Is an ortholog of human WNT10A (Wnt family member 10A) and WNT10B (Wnt family member 10B). Is predicted to have frizzled binding activity and receptor ligand activity. Is involved in several processes, including generation of neurons; nematode male tail tip morphogenesis; and neuroblast migration. Is expressed in several structures, including P6.pa; P6.pp; anchor cell; rectal epithelial cell; and tail. Human ortholog(s) of this gene are implicated in several diseases, including Mullerian aplasia and hyperandrogenism; autosomal dominant Robinow syndrome 1; and bone development disease (multiple).",Is an ortholog of human FZD5 (frizzled class receptor 5). Is predicted to have Wnt-activated receptor activity and Wnt-protein binding activity. Is involved in generation of neurons and neuroblast migration. Is expressed in intestine; nervous system; and pharynx. Human ortholog(s) of this gene are implicated in omodysplasia.
WBGene00016354,WBGene00006942,rig-6,wrk-1,1.0,118,Cell migration,Contactin (IgCAM),Ephrin co-receptor (IgCAM),"Is an ortholog of human CNTN4 (contactin 4) and CNTN6 (contactin 6). Is predicted to have cell-cell adhesion mediator activity. Is involved in several processes, including cell morphogenesis; negative regulation of defecation rhythm; and positive regulation of cellular component movement. Localizes to axon; neuronal cell body; and synapse. Is expressed in several structures, including excretory cell; muscle cell; neurons; rectal epithelium; and spermatheca. Human ortholog(s) of this gene are implicated in several diseases, including Compton-North congenital myopathy; MASA syndrome; and nonsyndromic deafness (multiple).","Is predicted to have axon guidance receptor activity. Is expressed in several structures, including SMDVL; body ganglion; head neurons; hermaphrodite distal tip cell; and interfacial epithelial cell. Human ortholog(s) of this gene are implicated in ovarian cancer."
WBGene00002280,WBGene00002081,let-2,ina-1,1.0,126,Cell adhesion,Collagen,Integrin,"Is an ortholog of human COL4A5 (collagen type IV alpha 5 chain) and COL4A6 (collagen type IV alpha 6 chain). Exhibits extracellular matrix structural constituent conferring tensile strength. Is involved in several processes, including embryo development; gonad morphogenesis; and regulation of distal tip cell migration. Localizes to collagen type IV trimer. Is expressed in several structures, including coelomocyte; egg-laying apparatus; rectal muscle; spermatheca; and tail.","Is an ortholog of human ITGA3 (integrin subunit alpha 3); ITGA6 (integrin subunit alpha 6); and ITGA7 (integrin subunit alpha 7). Exhibits transmembrane signaling receptor activity. Is involved in several processes, including cell-cell adhesion mediated by integrin; generation of neurons; and nematode male tail tip morphogenesis. Localizes to integrin complex and phagocytic cup. Is expressed in several structures, including distal tip cell; hermaphrodite gonad; male-specific anatomical entity; pharynx; and vulE. Is used to study epilepsy. Human ortholog(s) of this gene are implicated in several diseases, including congenital muscular dystrophy due to integrin alpha-7 deficiency; inherited blood coagulation disease (multiple); and junctional epidermolysis bullosa with pyloric atresia."
WBGene00004890,WBGene00004048,smp-2,plx-2,1.0,135,Cell migration,Semaphorin,Plexin (semaphorin receptor),"Is an ortholog of several human genes including SEMA6A (semaphorin 6A); SEMA6C (semaphorin 6C); and SEMA7A (semaphorin 7A (John Milton Hagen blood group)). Is predicted to have chemorepellent activity and semaphorin receptor binding activity. Is involved in nematode male tail mating organ morphogenesis. Is expressed in several structures, including hook; inner labial neurons; pharyngeal cell; ray; and vulval cell. Human ortholog(s) of this gene are implicated in CHARGE syndrome; hypogonadotropic hypogonadism (multiple); and retinal degeneration (multiple).","Is an ortholog of human PLXNC1 (plexin C1) and PLXND1 (plexin D1). Exhibits semaphorin receptor activity. Is involved in several processes, including generation of neurons; nematode larval development; and nematode male tail tip morphogenesis. Localizes to cell leading edge and cell surface. Is expressed in several structures, including P3/4L; P9/10L; P9/10R; neuroblasts; and ray structural cell."
WBGene00004264,WBGene00004210,qua-1,ptc-3,1.0,148,Hedgehog signaling,IHH,PTCH2,"Is an ortholog of human DHH (desert hedgehog signaling molecule); IHH (Indian hedgehog signaling molecule); and SHH (sonic hedgehog signaling molecule). Is involved in molting cycle and nematode larval development. Localizes to collagen and cuticulin-based cuticle extracellular matrix. Is expressed in several structures, including P1; P12; P2; excretory system; and hypodermal cell. Human ortholog(s) of this gene are implicated in several diseases, including 46 XY gonadal dysgenesis; bone development disease (multiple); and holoprosencephaly 3.","Is an ortholog of human PTCH1 (patched 1) and PTCH2 (patched 2). Is predicted to have hedgehog family protein binding activity; hedgehog receptor activity; and smoothened binding activity. Is involved in molting cycle. Localizes to apical plasma membrane and cytoplasmic vesicle. Is expressed in several structures, including CEP; cloaca; egg-laying apparatus; excretory duct; and preanal ganglion."
