Ligand_WB,Receptor_WB,Ligand_symbol,Receptor_symbol,score,index,LR Function,L Function,R Function,Ligand_desc,Receptor_desc
WBGene00004890,WBGene00004047,smp-2,plx-1,1.0,155,Cell migration,Semaphorin,Plexin (semaphorin receptor),"Is an ortholog of several human genes including SEMA6A (semaphorin 6A); SEMA6C (semaphorin 6C); and SEMA7A (semaphorin 7A (John Milton Hagen blood group)). Is predicted to have chemorepellent activity and semaphorin receptor binding activity. Is involved in nematode male tail mating organ morphogenesis. Is expressed in several structures, including hook; inner labial neurons; pharyngeal cell; ray; and vulval cell. Human ortholog(s) of this gene are implicated in CHARGE syndrome; hypogonadotropic hypogonadism (multiple); and retinal degeneration (multiple).","Is an ortholog of human PLXNA2 (plexin A2); PLXNA3 (plexin A3); and PLXNA4 (plexin A4). Exhibits semaphorin receptor activity. Is involved in epidermis development; male anatomical structure morphogenesis; and regulation of cellular component movement. Localizes to integral component of membrane and ruffle. Colocalizes with actin filament. Is expressed in several structures, including DA9; epithelial cell; non-striated muscle; somatic nervous system; and tail."
WBGene00004889,WBGene00004047,smp-1,plx-1,1.0,156,Cell migration,Semaphorin,Plexin (semaphorin receptor),"Is an ortholog of human SEMA6A (semaphorin 6A). Exhibits semaphorin receptor binding activity. Is involved in nematode male tail mating organ morphogenesis. Is expressed in several structures, including hermaphrodite distal tip cell; non-striated muscle; ray; somatic nervous system; and vulval cell. Human ortholog(s) of this gene are implicated in CHARGE syndrome; hypogonadotropic hypogonadism (multiple); and retinal degeneration (multiple).","Is an ortholog of human PLXNA2 (plexin A2); PLXNA3 (plexin A3); and PLXNA4 (plexin A4). Exhibits semaphorin receptor activity. Is involved in epidermis development; male anatomical structure morphogenesis; and regulation of cellular component movement. Localizes to integral component of membrane and ruffle. Colocalizes with actin filament. Is expressed in several structures, including DA9; epithelial cell; non-striated muscle; somatic nervous system; and tail."
WBGene00003029,WBGene00003006,lin-44,lin-17,1.0,158,Wnt signaling,Wnt,Frizzled,"Is an ortholog of human WNT10A (Wnt family member 10A) and WNT10B (Wnt family member 10B). Is predicted to have frizzled binding activity and receptor ligand activity. Is involved in several processes, including generation of neurons; nematode male tail tip morphogenesis; and neuroblast migration. Is expressed in several structures, including P6.pa; P6.pp; anchor cell; rectal epithelial cell; and tail. Human ortholog(s) of this gene are implicated in several diseases, including Mullerian aplasia and hyperandrogenism; autosomal dominant Robinow syndrome 1; and bone development disease (multiple).","Is an ortholog of human FZD4 (frizzled class receptor 4). Exhibits receptor tyrosine kinase binding activity. Is involved in several processes, including asymmetric protein localization involved in cell fate determination; axis specification; and generation of neurons. Localizes to neuron projection membrane. Is expressed in several structures, including P3.p male; P4.p male; PQR; epithelial cell; and male-specific anatomical entity. Human ortholog(s) of this gene are implicated in exudative vitreoretinopathy 1."
WBGene00006951,WBGene00004208,wrt-5,ptc-1,1.0,168,Hedgehog signaling,DHH,PTCH1,"Is predicted to have signaling receptor binding activity. Is expressed in several structures, including excretory system; hermaphrodite gonad; pharyngeal-intestinal valve; phasmid socket cell; and rectal valve cell. Human ortholog(s) of this gene are implicated in several diseases, including 46 XY gonadal dysgenesis; bone development disease (multiple); and holoprosencephaly 3.",Is an ortholog of human PTCH1 (patched 1) and PTCH2 (patched 2). Is predicted to have hedgehog family protein binding activity; hedgehog receptor activity; and smoothened binding activity. Is involved in molting cycle. Localizes to integral component of plasma membrane. Is used to study Parkinson's disease.
WBGene00002108,WBGene00000898,ins-25,daf-2,1.0,194,Insulin signaling,ILP,IGFR,Is predicted to have hormone activity. Is expressed in motor neurons; nerve ring neurons; and tail neurons.,"Is an ortholog of human IGF1R (insulin like growth factor 1 receptor); INSR (insulin receptor); and INSRR (insulin receptor related receptor). Exhibits PTB domain binding activity; SH2 domain binding activity; and protein kinase binding activity. Is involved in several processes, including dauer exit; regulation of cellular catabolic process; and regulation of gene expression. Localizes to several cellular components, including cytoplasmic vesicle; neuronal cell body; and spanning component of plasma membrane. Is expressed in amphid neurons; gonad; hypodermis; and nerve ring. Is used to study Parkinson's disease. Human ortholog(s) of this gene are implicated in several diseases, including gastrointestinal system cancer (multiple); hematologic cancer (multiple); and synostosis (multiple)."
WBGene00002246,WBGene00001609,lag-2,glp-1,1.0,208,Notch signaling,DLL,Notch,"Exhibits Notch binding activity. Is involved in several processes, including maintenance of dauer; positive regulation of stem cell proliferation; and regulation of vulval development. Localizes to cell projection membrane; integral component of plasma membrane; and neuronal cell body membrane. Is expressed in several structures, including distal tip cell; germ line; hypodermal cell; neurons; and vulval cell.","Is an ortholog of human NOTCH1 (notch receptor 1); NOTCH2 (notch receptor 2); and NOTCH3 (notch receptor 3). Exhibits RNA polymerase II transcription factor binding activity and transcription coactivator activity. Is involved in several processes, including maintenance of dauer; pharyngeal muscle development; and positive regulation of cell population proliferation. Localizes to several cellular components, including RNA polymerase II transcription factor complex; lateral plasma membrane; and spanning component of plasma membrane. Is expressed in several structures, including anus; germ line; neurons; somatic nervous system; and vulval precursor cell. Is used to study cancer. Human ortholog(s) of this gene are implicated in several diseases, including Adams-Oliver syndrome; Alagille syndrome; and CADASIL 1."
WBGene00000185,WBGene00003001,arg-1,lin-12,1.0,210,Notch signaling,DLL,Notch,Is expressed in head; head mesodermal cell; non-striated muscle; somatic gonad precursor; and tail. Is predicted to encode a protein with the following domains: Delta serrate ligand; EGF-like domain; and Delta/Serrate/lag-2 (DSL) protein.,"Is an ortholog of human NOTCH4 (notch receptor 4). Exhibits RNA polymerase II transcription factor binding activity. Is involved in several processes, including nematode larval development; oviposition; and positive regulation of mesodermal cell fate specification. Localizes to RNA polymerase II transcription factor complex and apical plasma membrane. Is expressed in several structures, including body wall muscle cell from M lineage; gonadal sheath cell; somatic nervous system; vulval cell; and vulval precursor cell."
WBGene00006852,WBGene00006745,unc-129,unc-5,1.0,226,Cell migration,BMP non-canonical,Immunoglobulin,"Is an ortholog of human BMP3 (bone morphogenetic protein 3) and GDF10 (growth differentiation factor 10). Exhibits signaling receptor binding activity. Is involved in several processes, including backward locomotion; cell morphogenesis; and inductive cell migration. Is expressed in several structures, including CAN; PDE socket cell; body wall musculature; cholinergic neurons; and terminal bulb.","Is an ortholog of human UNC5A (unc-5 netrin receptor A); UNC5B (unc-5 netrin receptor B); and UNC5C (unc-5 netrin receptor C). Exhibits netrin receptor activity and protein tyrosine kinase binding activity. Is involved in several processes, including establishment or maintenance of actin cytoskeleton polarity; generation of neurons; and nematode male tail tip morphogenesis. Localizes to axonal growth cone. Is expressed in several structures, including distal tip cell; excretory canal; head neurons; motor neurons; and somatic nervous system."
WBGene00000936,WBGene00020649,dbl-1,sma-10,1.0,227,TGF-B signaling,BMP5,TGF-B-R,"Is an ortholog of human BMP10 (bone morphogenetic protein 10). Is predicted to have BMP receptor binding activity; cytokine activity; and protein serine/threonine kinase activator activity. Is involved in several processes, including defense response to other organism; nematode male tail tip morphogenesis; and positive regulation of macromolecule biosynthetic process. Is expressed in body wall musculature; nervous system; pm2 precursor; and in male. Is used to study Marfan syndrome. Human ortholog(s) of this gene are implicated in situs inversus.","Is an ortholog of human LRIG1 (leucine rich repeats and immunoglobulin like domains 1); LRIG2 (leucine rich repeats and immunoglobulin like domains 2); and LRIG3 (leucine rich repeats and immunoglobulin like domains 3). Exhibits type I transforming growth factor beta receptor binding activity and type II transforming growth factor beta receptor binding activity. Is involved in several processes, including positive regulation of transforming growth factor beta receptor signaling pathway; regulation of mesodermal cell fate specification; and transforming growth factor beta receptor signaling pathway. Localizes to integral component of plasma membrane. Human ortholog(s) of this gene are implicated in congenital stationary night blindness 1F and familial temporal lobe epilepsy 1."
WBGene00000936,WBGene00003056,dbl-1,lon-2,1.0,229,TGF-B signaling,BMP5,TGF-B-R,"Is an ortholog of human BMP10 (bone morphogenetic protein 10). Is predicted to have BMP receptor binding activity; cytokine activity; and protein serine/threonine kinase activator activity. Is involved in several processes, including defense response to other organism; nematode male tail tip morphogenesis; and positive regulation of macromolecule biosynthetic process. Is expressed in body wall musculature; nervous system; pm2 precursor; and in male. Is used to study Marfan syndrome. Human ortholog(s) of this gene are implicated in situs inversus.","Exhibits growth factor binding activity. Is involved in several processes, including negative regulation of transforming growth factor beta receptor signaling pathway; regulation of mesodermal cell fate specification; and transforming growth factor beta receptor signaling pathway involved in regulation of growth. Localizes to cell surface. Is expressed in hypodermis and intestine."
WBGene00019407,WBGene00011345,K05F1.5,dma-1,1.0,230,Cell migration,LECT2,Neuronal tran-mb R,"Is an ortholog of human LECT2 (leukocyte cell derived chemotaxin 2). Is involved in innervation; regulation of dendrite extension; and regulation of dendrite morphogenesis. Localizes to several cellular components, including cell surface; perikaryon; and sensory dendrite. Is expressed in body wall musculature; coelomocyte; head neurons; and ventral cord neurons.",Exhibits protease binding activity. Is involved in generation of neurons. Localizes to dendrite membrane. Is expressed in head neurons; mechanosensory neurons; somatic nervous system; and vulva. Human ortholog(s) of this gene are implicated in cornea plana.
WBGene00003774,WBGene00011345,mnr-1,dma-1,1.0,232,Cell migration,GRIN1,Neuronal tran-mb R,Is an ortholog of human GRIN1 (glutamate ionotropic receptor NMDA type subunit 1). Is predicted to contribute to NMDA glutamate receptor activity. Is involved in locomotory behavior and regulation of forward locomotion. Localizes to integral component of plasma membrane; neuron projection; and synapse. Is expressed in gonadal sheath cell and oocyte. Human ortholog(s) of this gene are implicated in autosomal dominant non-syndromic intellectual disability 8.,Exhibits protease binding activity. Is involved in generation of neurons. Localizes to dendrite membrane. Is expressed in head neurons; mechanosensory neurons; somatic nervous system; and vulva. Human ortholog(s) of this gene are implicated in cornea plana.
WBGene00003169,WBGene00003168,mec-5,mec-4,1.0,237,Mechanosensory mechanism,ECM protein,DEG/ENaC channel (receptor of ECM mec proteins),"Is predicted to have extracellular matrix structural constituent. Is involved in several processes, including detection of mechanical stimulus involved in sensory perception of touch; positive regulation of detection of mechanical stimulus involved in sensory perception of touch; and positive regulation of mechanosensory behavior. Localizes to extracellular matrix. Is expressed in head; hypodermis; muscle cell; tail; and touch receptor neurons.","Is an ortholog of human SCNN1B (sodium channel epithelial 1 subunit beta) and SCNN1G (sodium channel epithelial 1 subunit gamma). Exhibits ligand-gated sodium channel activity. Is involved in several processes, including detection of mechanical stimulus involved in sensory perception of touch; negative regulation of turning behavior involved in mating; and positive regulation of detection of mechanical stimulus involved in sensory perception of touch. Localizes to axon; integral component of plasma membrane; and neuron projection membrane. Is expressed in touch receptor neurons. Is used to study hypokalemic periodic paralysis; ischemia; and neurodegenerative disease. Human ortholog(s) of this gene are implicated in bronchiectasis (multiple) and renal tubular transport disease (multiple)."
WBGene00003169,WBGene00003174,mec-5,mec-10,1.0,240,Mechanosensory mechanism,ECM protein,DEG/ENaC channel (receptor of ECM mec proteins),"Is predicted to have extracellular matrix structural constituent. Is involved in several processes, including detection of mechanical stimulus involved in sensory perception of touch; positive regulation of detection of mechanical stimulus involved in sensory perception of touch; and positive regulation of mechanosensory behavior. Localizes to extracellular matrix. Is expressed in head; hypodermis; muscle cell; tail; and touch receptor neurons.","Is an ortholog of human SCNN1A (sodium channel epithelial 1 subunit alpha); SCNN1B (sodium channel epithelial 1 subunit beta); and SCNN1G (sodium channel epithelial 1 subunit gamma). Exhibits ligand-gated sodium channel activity. Is involved in several processes, including detection of mechanical stimulus involved in sensory perception of touch; positive regulation of detection of mechanical stimulus involved in sensory perception of touch; and positive regulation of mechanosensory behavior. Localizes to cell body membrane. Is expressed in neurons. Human ortholog(s) of this gene are implicated in bronchiectasis (multiple) and renal tubular transport disease (multiple)."
